Code,Title,Description
framework,Framework agreement procedure first stage,The contracting process is the second stage of a framework agreement procedure. The related process is the contracting process that established the framework agreement.
planning,Planning process,The related process is the planning process that planned the contracting process.
parent,Parent contract (for sub-contracts),This contracting process might result in a sub-contract of the related process.
prior,Prior process,The related process is a contracting process that concluded related contracts.
prior.replacement,Prior process (replacement),The contracting process aims to replace one or more contracts from the related contracting process.
prior.renewal,Prior process (renewal),The contracting process aims to renew one or more contracts from the related contracting process.
prior.additional,Prior process (additional),"The contracting process aims to purchase additional goods, services or works related to the goods, services or works purchased from the same supplier in the related contracting process."
prior.repetition,Prior process (repetition),"The contracting process aims to purchase new goods, services or works constituting a repetition of the goods, services or works purchased from the same supplier in the related contracting process."
unsuccessfulProcess,Unsuccessful process,The contracting process is another attempt to conclude some contract(s). The related process is the contracting process that attempted and failed to conclude the contract(s) previously.
