Code,Title,Description,Deprecated,Deprecation note
planning,Planning,"A future contracting process is being considered. Early information about the process can be provided in the tender section. A process with this status might provide information on early engagement or consultation opportunities, during which the details of a subsequent tender can be shaped.",1.2,
planned,Planned,"The contracting process is scheduled, but is not yet taking place. Details of the anticipated dates can be provided in the tender block.",,
active,Active,"The procurement documents are published, and the bid submission deadline has not yet passed.",,
complete,Complete,The bid submission deadline has passed.,,
cancelled,Cancelled,"The contracting process was cancelled by the buyer or the procuring entity (e.g. because of a change in needs, insufficient funds, or technical or procedural errors) after the procurement documents were published, but not later than the bid submission deadline.",,
unsuccessful,Unsuccessful,"The contracting process failed after the procurement documents were published, but not later than the bid submission deadline (e.g. no bids were received, all bids were withdrawn by the bidders, all bids were rejected by the buyer or the procuring entity).",,
withdrawn,Withdrawn,No further information on the contracting process is available under this ocid.,,
