Field Name,Description,Format
name,"The name of the contact person, department, or contact point, for correspondence relating to this contracting process.", string
email,The e-mail address of the contact point/person., string
telephone,The telephone number of the contact point/person. This should include the international dialling code., string
faxNumber,The fax number of the contact point/person. This should include the international dialling code., string
url,A web address for the contact point/person.,uri string
