Field Name,Description,Format
id,A local identifier to reference and merge the items by. Must be unique within a given array of items.,
description,"A description of the goods, services to be provided.",
classification,See Identifier,Reference
additionalClassifications,[Consult codelist] The primary classification for the item. See the codelists to know which are preferred schemas.,
quantity,The number of units required,
unit,"Description of the unit which the good comes in e.g. hours, kilograms",
